Question,OriginalOrder,Answer
What does pip stand for python?,python,"['Preferred', 'Installer', 'Program']"
"Python supports the creation of anonymous functions at runtime, using a construct called",python,['lambda']
Is Python code compiled or interpreted?,python,"['yes', 'Interpreted']"
What is a pass in Python?,python,"['means', 'performing', 'operation']"
what is python?,python,"['Python', 'programing', 'language']"
Which keyword is used for function in Python language?,python,['def']
What is a break statement,python,"['used', 'break', 'loop', 'statement']"
Who developed Python Programming Language?,python,"['Guido', 'van', 'Rossum']"
Can we Pass a function as an argument in Python?,python,['yes']
What does the ‘#’ symbol do in Python?,python,"['used', 'comment']"
